{
  "$schema": "http://json-schema.org/draft-07/schema#",
  "$id": "https://clawrocket.dev/contracts/editorial-room/v0/get_run.output.schema.json",
  "title": "GetRunOutput",
  "description": "MCP RPC: get_run output. Includes the SkillResult discriminated union by `kind`. See EDITORIAL_ROOM_CONTRACT.md §6.3.",
  "type": "object",
  "additionalProperties": false,
  "definitions": {
    "InlineError": {
      "type": "object",
      "additionalProperties": false,
      "required": ["code", "message"],
      "properties": {
        "code": { "type": "string", "minLength": 1 },
        "message": { "type": "string", "minLength": 1 }
      },
      "description": "Inline error subset used by GetRunOutput.error. The standalone errors.schema.json envelope additionally carries `details`; this inline shape is intentionally narrower per §6.3."
    },
    "Progress": {
      "type": "object",
      "additionalProperties": false,
      "required": ["current_step", "pct"],
      "properties": {
        "current_step": { "type": "string", "minLength": 1 },
        "pct": { "type": "number", "minimum": 0, "maximum": 100 }
      }
    },
    "SkillResult": {
      "oneOf": [
        {
          "type": "object",
          "additionalProperties": false,
          "required": ["kind", "data"],
          "properties": {
            "kind": { "const": "score" },
            "data": {
              "$ref": "https://clawrocket.dev/contracts/editorial-room/v0/score_result.schema.json"
            }
          }
        },
        {
          "type": "object",
          "additionalProperties": false,
          "required": ["kind", "data"],
          "properties": {
            "kind": { "const": "suggestions" },
            "data": {
              "type": "array",
              "items": {
                "$ref": "https://clawrocket.dev/contracts/editorial-room/v0/suggestion.schema.json"
              }
            }
          }
        },
        {
          "type": "object",
          "additionalProperties": false,
          "required": ["kind", "data"],
          "properties": {
            "kind": { "const": "proposals" },
            "data": {
              "type": "array",
              "items": {
                "$ref": "https://clawrocket.dev/contracts/editorial-room/v0/proposal_card.schema.json"
              }
            }
          }
        },
        {
          "type": "object",
          "additionalProperties": false,
          "required": ["kind", "data"],
          "properties": {
            "kind": { "const": "discussion_turn" },
            "data": {
              "$ref": "https://clawrocket.dev/contracts/editorial-room/v0/discussion_session.schema.json#/definitions/DiscussionTurn"
            }
          }
        },
        {
          "type": "object",
          "additionalProperties": false,
          "required": ["kind", "data"],
          "properties": {
            "kind": { "const": "outline" },
            "data": {
              "type": "object",
              "description": "Outline shape — full schema deferred per §11 ('Outline page schema'). 0p uses fixtures."
            }
          }
        },
        {
          "type": "object",
          "additionalProperties": false,
          "required": ["kind", "data"],
          "properties": {
            "kind": { "const": "raw_text" },
            "data": { "type": "string" }
          }
        }
      ]
    }
  },
  "required": [
    "schema_version",
    "run_id",
    "status",
    "progress",
    "result",
    "error",
    "cost_so_far_usd",
    "elapsed_ms",
    "partial_provider_failures"
  ],
  "properties": {
    "schema_version": { "const": "0" },
    "run_id": { "type": "string", "minLength": 1 },
    "status": {
      "type": "string",
      "enum": ["queued", "running", "completed", "failed", "partial"]
    },
    "progress": {
      "anyOf": [{ "type": "null" }, { "$ref": "#/definitions/Progress" }]
    },
    "result": {
      "anyOf": [{ "type": "null" }, { "$ref": "#/definitions/SkillResult" }],
      "description": "Present when status in {completed, partial}."
    },
    "error": {
      "anyOf": [{ "type": "null" }, { "$ref": "#/definitions/InlineError" }]
    },
    "cost_so_far_usd": { "type": "number", "minimum": 0 },
    "elapsed_ms": { "type": "number", "minimum": 0 },
    "partial_provider_failures": {
      "type": "array",
      "items": { "type": "string" },
      "description": "Names of providers that errored but didn't kill the run."
    }
  }
}
