{
  "schema_version": "0",
  "run_id": "01HXYZRUNADVCUT001AAAAAAAAA",
  "status": "completed",
  "progress": null,
  "result": {
    "kind": "suggestions",
    "data": [
      {
        "schema_version": "0",
        "revision_id": "01HXYZREV001AAAAAAAAAAAAAA",
        "target_content_hash": "sha256:rev001aaa00000000000000000000000000000000000000000000000000000000",
        "source_map_refs": [
          {
            "block_id": "blk_0001",
            "span_id": null,
            "text_hash": "sha256:b0001hash00000000000000000000000000000000000000000000000000000000"
          }
        ],
        "markdown_range": { "start": 0, "end": 4 },
        "anchor_quote": "When",
        "anchor_content_hash": "sha256:rev001aaa00000000000000000000000000000000000000000000000000000000",
        "anchor_context_before": "",
        "anchor_context_after": " Embracer wrote down",
        "replacement": null,
        "rationale": "Trim 'When' filler — the temporal anchor 'last quarter' carries the timing.",
        "category": "filler",
        "source_skill": "factory_adv_cut",
        "source_run_id": "01HXYZRUNADVCUT001AAAAAAAAA"
      },
      {
        "schema_version": "0",
        "revision_id": "01HXYZREV001AAAAAAAAAAAAAA",
        "target_content_hash": "sha256:rev001aaa00000000000000000000000000000000000000000000000000000000",
        "source_map_refs": [
          {
            "block_id": "blk_0003",
            "span_id": null,
            "text_hash": "sha256:b0003hash00000000000000000000000000000000000000000000000000000000"
          }
        ],
        "markdown_range": { "start": 580, "end": 624 },
        "anchor_quote": "may have been reclassified",
        "anchor_content_hash": "sha256:rev001aaa00000000000000000000000000000000000000000000000000000000",
        "anchor_context_before": "MG itself ",
        "anchor_context_after": " as a conditional liability",
        "replacement": "is reclassified",
        "rationale": "Hedge: 'may have been' weakens a claim sourced to filings; the 8-K is unambiguous.",
        "category": "hedge",
        "source_skill": "factory_adv_cut",
        "source_run_id": "01HXYZRUNADVCUT001AAAAAAAAA"
      }
    ]
  },
  "error": null,
  "cost_so_far_usd": 0.04,
  "elapsed_ms": 7890,
  "partial_provider_failures": []
}
