{
  "schema_version": "0",
  "run_id": "01HXYZRUNPARTIAL001AAAAAAAA",
  "status": "partial",
  "progress": null,
  "result": {
    "kind": "discussion_turn",
    "data": {
      "id": "01HXYZTURN001AAAAAAAAAAAAAA",
      "user_message": "Where should the angle land — deal-shape or accounting?",
      "initiator": "user",
      "initiated_action": null,
      "agent_responses": [
        {
          "agent_profile_id": "agent/argus",
          "provider_id": "anthropic",
          "model_id": "claude-opus-4-7",
          "text": "The accounting reclassification is the load-bearing piece — without it the deal shape doesn't lock. Lead with the reclassification.",
          "citations": [],
          "cost_usd": 0.018,
          "latency_ms": 4210,
          "status": "completed",
          "error_message": null
        },
        {
          "agent_profile_id": "agent/scribe",
          "provider_id": "anthropic",
          "model_id": "claude-sonnet-4-6",
          "text": "Pushing back: a person needs to land in §2. The reclassification is correct but bloodless. Use the Annapurna note.",
          "citations": [],
          "cost_usd": 0.006,
          "latency_ms": 3120,
          "status": "completed",
          "error_message": null
        },
        {
          "agent_profile_id": "agent/mei-cohort",
          "provider_id": "google",
          "model_id": "gemini-2.5-pro",
          "text": "",
          "citations": [],
          "cost_usd": 0,
          "latency_ms": 9999,
          "status": "timed_out",
          "error_message": "provider timeout after 10000ms"
        }
      ],
      "proposals": [],
      "retained_for_session": false,
      "cost_usd": 0.024,
      "latency_ms": 10100,
      "partial_provider_failures": ["google"],
      "created_at": "2026-04-30T11:42:00.000Z"
    }
  },
  "error": null,
  "cost_so_far_usd": 0.024,
  "elapsed_ms": 10100,
  "partial_provider_failures": ["google"]
}
